{
  "name": "Carlos Mendes",
  "email": "carlos.m@webflowcraft.com",
  "role": "full-stack JavaScript engineer",
  "location": "Porto, Portugal",
  "skills": [
    "React",
    "Node.js",
    "Next.js",
    "PostgreSQL"
  ],
  "previousCompanies": [
    "OutSystems"
  ],
  "interests": [
    "developer experience (DX)",
    "micro frontends",
    "performance optimization"
  ],
  "experience": "7+ years of experience building SaaS platforms and high-performance web apps for startups across the US and Europe.",
  "description": "Carlos Mendes (carlos.m@webflowcraft.com) is a full-stack JavaScript engineer working remotely from Porto, Portugal. \nWith 7+ years of experience, Carlos builds SaaS platforms and high-performance web apps for startups across the US and Europe. \nHe specializes in React, Node.js, Next.js, and PostgreSQL, and is a contributor to the React Hook Form library. \nCarlos has delivered end-to-end apps for clients in healthtech, edtech, and travel â€” including a real-time collaboration platform for a YC-backed company. \nBefore freelancing full-time, he worked at OutSystems as a frontend lead. \nCarlos is deeply interested in developer experience (DX), micro frontends, and performance optimization. \nHe also teaches advanced TypeScript workshops and runs a YouTube channel focused on debugging and testing patterns.",
  "uuid": "d20e4a22-0c6d-47dd-84c8-5457df6de3aa",
  "createdAt": "2025-07-15T10:44:56.626Z",
  "updatedAt": "2025-07-15T10:44:56.626Z"
}