{
  "name": "Michael Anderson",
  "email": "michael.anderson@cloudops.io",
  "role": "Senior DevOps Engineer",
  "location": "Austin, Texas",
  "skills": [
    "CI/CD",
    "cloud infrastructure",
    "automation",
    "AWS",
    "GCP",
    "Terraform",
    "Kubernetes",
    "Docker",
    "Jenkins",
    "Helm",
    "Prometheus",
    "Bash scripting"
  ],
  "previousCompanies": [
    "IBM",
    "Netflix"
  ],
  "interests": [
    "open-source monitoring tools",
    "mentoring junior engineers"
  ],
  "experience": "Over 10 years of experience in CI/CD, cloud infrastructure, and automation. Leads infrastructure-as-code initiatives using Terraform and Kubernetes at CloudOps, reducing deployment times by 40%.",
  "description": "Michael Anderson (michael.anderson@cloudops.io) is a senior DevOps engineer currently living in Austin, Texas. \nHe has over 10 years of experience in CI/CD, cloud infrastructure, and automation, and is certified in both AWS and GCP. \nMichael began his career as a systems administrator at IBM, then transitioned to a cloud architect role at Netflix. \nAt his current role at CloudOps, he leads infrastructure-as-code initiatives using Terraform and Kubernetes, and has reduced deployment times by 40%. \nHis technical toolkit includes Docker, Jenkins, Helm, Prometheus, and Bash scripting. \nIn his free time, Michael contributes to open-source monitoring tools and enjoys mentoring junior engineers through TechBridge.",
  "uuid": "93a4e80b-18cc-4d87-b897-c9bcd7f9f1d2",
  "createdAt": "2025-07-15T13:26:12.786Z",
  "updatedAt": "2025-07-15T13:26:12.786Z"
}